title,detail_title,job_url,company,company_name_full,company_url,company_url_from_job,salary_list,detail_salary,address_list,detail_location,exp_list,detail_experience,deadline,tags,working_addresses,working_times,desc_mota,desc_yeucau,desc_quyenloi,company_website,company_size,company_industry,company_address,company_description
Data Analyst,Data Analyst,https://www.topcv.vn/viec-lam/data-analyst/1862735.html?ta_source=JobSearchList_LinkDetail&u_sr_id=P6Zi3k1on4la7LzJKAoJIqJnvqVSOffbE5DvZFFq_1757087864,Công ty Cổ phần viễn thông FPT,Công ty Cổ phần viễn thông FPT,https://www.topcv.vn/cong-ty/cong-ty-co-phan-vien-thong-fpt/198732.html,https://www.topcv.vn/cong-ty/cong-ty-co-phan-vien-thong-fpt/198732.html,Thoả thuận,Thoả thuận,Hà Nội,Hà Nội,3 năm,3 năm,05/10/2025,Chuyên môn Data Analyst; IT - Phần mềm; Viễn thông,"- Hà Nội: Số 48 Vạn Bảo, Phường Ngọc Khánh, Ba Đình",,"Xây dựng, phát triển và duy trì định kỳ các báo cáo vận hành, hỗ trợ ra quyết định. Phối hợp chặt chẽ với các phòng ban, bộ phận và trung tâm để hiểu rõ nhu cầu và yêu cầu phân tích dữ liệu của các bên. Đánh giá và kiểm tra các dữ liệu thu thập từ người dùng Hợp tác với data engineer và data scientist để xây dựng các bộ dữ liệu chất lượng cao và mô hình học má","Tốt nghiệp đại học chuyên ngành Khoa học dữ liệu, Toán ứng dụng, Kỹ thuật viễn thông hoặc các chuyên ngành kỹ thuật có liên quan. Có từ 3 năm kinh nghiệm tại vị trí phân tích dữ liệu hoặc tương đương. Có kỹ năng phân tích, trình bày thông tin rõ ràng dưới dạng bản báo cáo, thuyết trình, kỹ năng trình bày tốt. Sử dụng thành thạo một trong ngôn ngữ truy vấn cơ sở dữ liệu (SQL, NoSQL…) và công cụ phân tích dữ liệu (Excel, BI tools, Python…). Có định hướng, mục tiêu rõ ràng, làm việc tốt trong môi trường có nhịp độ nhanh. Có nền tảng về network hoặc viễn thông là một lợi thế.","Gói thu nhập năm hấp dẫn (13 tháng lương, thưởng hiệu quả kinh doanh, thưởng Quý, Năm...). Đầy đủ các chế độ theo luật lao động hiện hành. Chính sách phúc lợi theo quy định của Công ty đa dạng: Chăm sóc sức khỏe định kì hàng năm; Gói bảo hiểm sức khỏe chuyên biệt (FPT Care – Khám chữa bệnh miễn phí tại tất cả các bệnh viện); Các hoạt động tri ân, chăm lo đời sống tinh thần CBNV và Thân nhân ... Môi trường làm việc thân thiện, cởi mở. Cơ sở vật chất và công cụ làm việc hiện đại, tiện nghi. Nhiều cơ hội phát triển và thăng tiến. Văn hóa Doanh nghiệp đặc sắc, sinh động bậc nhất với nhiều các hoạt động hấp dẫn: tân binh, teambuilding, thi trạng, hội làng, hội diễn Sao Chổi, sinh nhật FPT, ngày 08/03, ngày 11/11... Hưởng các gói ưu đãi cước khi sử dụng dịch vụ của FPT Telecom.",,,,"""FPT Telecom Vùng phủ vươn xa, Kết nối mọi nhà"" Xem thêm Thu gọn Tuyển dụng Tất cả tỉnh/thành phố Hà Nội Hồ Chí Minh Bình Dương Bắc Ninh Đồng Nai Hưng Yên Hải Dương Đà Nẵng Hải Phòng An Giang Bà Rịa-Vũng Tàu Bắc Giang Bắc Kạn Bạc Liêu Bến Tre Bình Định Bình Phước Bình Thuận Cà Mau Cần Thơ Cao Bằng Cửu Long Đắk Lắk Đắc Nông Điện Biên Đồng Tháp Gia Lai Hà Giang Hà Nam Hà Tĩnh Hậu Giang Hoà Bình Khánh Hoà Kiên Giang Kon Tum Lai Châu Lâm Đồng Lạng Sơn Lào Cai Long An Miền Bắc Miền Nam Miền Trung Nam Định Nghệ An Ninh Bình Ninh Thuận Phú Thọ Phú Yên Quảng Bình Quảng Nam Quảng Ngãi Quảng Ninh Quảng Trị Sóc Trăng Sơn La Tây Ninh Thái Bình Thái Nguyên Thanh Hoá Thừa Thiên Huế Tiền Giang Toàn Quốc Trà Vinh Tuyên Quang Vĩnh Long Vĩnh Phúc Yên Bái Nước Ngoài Đức Nhật Bản Tìm kiếm 1 /12 trang Xem tất cả việc làm với từ khóa “ ” Thương hiệu lớn tiêu biểu cùng lĩnh vực Pro Company Những thương hiệu tuyển dụng đã khẳng định được vị thế trên thị trường. Chi nhánh Công trình Viettel Phú Thọ - Tổng Công ty CP Công trình Viettel Viễn thông Tổng Công ty Công nghiệp Công nghệ cao Viettel Viễn thông Công ty Cổ phần viễn thông FPT Viễn thông Công ty cổ phần tư vấn chuyển giao công nghệ ITC Viễn thông Công ty cổ phần công nghệ - viễn thông Elcom Viễn thông TẬP ĐOÀN CÔNG NGHIỆP - VIỄN THÔNG QUÂN ĐỘI Viễn thông CHI NHÁNH CÔNG TRÌNH VIETTEL BÌNH ĐỊNH - TỔNG CÔNG TY CỔ PHẦN CÔNG TRÌNH VIETTEL Viễn thông Công Ty TNHH MTV Viễn Thông Quốc Tế FPT Viễn thông Trung Tâm Nghiên Cứu Và Phát Triển Mobifone - Tổng Công Ty Viễn Thông Mobifone Viễn thông Công ty cổ phần Hạ tầng Viễn thông CMC Telecom Viễn thông Tìm hiểu thêm về TopCV Pro Việc làm “ ” từ các công ty tương tự Thông tin liên hệ Địa chỉ công ty Tầng 2, tòa nhà FPT, Phố Duy Tân, Cầu Giấy, Hà Nội Xem bản đồ Chia sẻ công ty tới bạn bè Sao chép đường dẫn Chia sẻ qua mạng xã hội",
Phân Tích Dữ Liệu Kinh Doanh,Phân Tích Dữ Liệu Kinh Doanh,https://www.topcv.vn/viec-lam/phan-tich-du-lieu-kinh-doanh/1862546.html?ta_source=JobSearchList_LinkDetail&u_sr_id=P6Zi3k1on4la7LzJKAoJIqJnvqVSOffbE5DvZFFq_1757087864,Công ty Cổ phần viễn thông FPT,Công ty Cổ phần viễn thông FPT,https://www.topcv.vn/cong-ty/cong-ty-co-phan-vien-thong-fpt/198732.html,https://www.topcv.vn/cong-ty/cong-ty-co-phan-vien-thong-fpt/198732.html,15 - 25 triệu,15 - 25 triệu,Hà Nội,Hà Nội,2 năm,2 năm,05/10/2025,Chuyên môn Data Analyst; IT - Phần mềm; Nghỉ thứ 7,"- Hà Nội: Tòa nhà Detech 2 số 107 Nguyễn Phong Sắc, Cầu Giấy",Thứ 2 - Thứ 6 (từ 08:00 đến 17:30),"Mục tiêu công việc: Phân tích dữ liệu người dùng trên website và ứng dụng thương mại điện tử (ECOM) của FPT Telecom, xây dựng hệ thống pipeline để đo lường user flow, từ đó cung cấp insight nhằm cải thiện trải nghiệm người dùng (UX). Phối hợp chặt chẽ với Growth team để theo dõi, phân tích và đánh giá hiệu quả các chiến dịch marketing, góp phần tối ưu chuyển đổi và tăng trưởng. Nắm bắt kiến thức về AI, LLM, MCP và RAG để chuẩn bị nền tảng cho việc phát triển hệ thống agent thông minh trong tương lai. Chi tiết công việc: Thiết kế, triển khai và quản trị data pipeline thu thập & xử lý dữ liệu hành vi người dùng từ website và app ECOM. Phân tích user journey, funnel, retention để phát hiện điểm nghẽn và đưa ra đề xuất tối ưu UX. Xây dựng dashboard và báo cáo trực quan nhằm theo dõi KPI về engagement, retention, conversion. Hỗ trợ Growth team theo dõi, phân tích dữ liệu từ các chiến dịch marketing (digital campaigns, performance ads, email, push notification, v.v.) và đánh giá ROI. Phối hợp với Product Manager, Growth team, UX/UI Designer và Developer để biến insight thành cải tiến sản phẩm và chiến lược tăng trưởng. Thực hiện A/B testing, cohort analysis cho các chiến dịch và luồng người dùng quan trọng. Cập nhật xu hướng AI/LLM, MCP, RAG và đóng góp ý tưởng cho roadmap phát triển hệ thống agent thông minh.","Trình độ tương đương Đại học trở lên chuyên ngành Khoa học Dữ liệu, CNTT, Kinh tế hoặc liên quan. Có 2–3 năm kinh nghiệm trong lĩnh vực Data Analyst, Data Engineer hoặc Business Intelligence. Thành thạo SQL, Python (Pandas, NumPy), ETL pipelines. Biết sử dụng Tableau, Power BI hoặc công cụ visualization tương đương. Kỹ năng phân tích user journey, funnel metrics, A/B testing. Hiểu biết về web/app analytics (Google Analytics, Mixpanel, Amplitude…). Ưu tiên ứng viên có kinh nghiệm trong fintech, trading platform, cloud data platform (AWS, GCP, Azure) và các công cụ như dbt, Airflow, BigQuery, Snowflake. Quan tâm và có kiến thức về AI/ML, LLMs, MCP, RAG là một lợi thế.","Gói thu nhập hấp dẫn theo năng lực (Thưởng lương tháng 13, tiền du lịch nghỉ mát...). Đầy đủ các chế độ theo luật lao động hiện hành. Chính sách phúc lợi theo quy định của Công ty đa dạng: Chăm sóc sức khỏe định kì hàng năm; Gói bảo hiểm sức khỏe chuyên biệt (FPT Care – Khám chữa bệnh miễn phí tại tất cả các bệnh viện); Các hoạt động tri ân, chăm lo đời sống tinh thần CBNV và Thân nhân... Văn hóa Doanh nghiệp đặc sắc, sinh động bậc nhất với nhiều các hoạt động hấp dẫn: tân binh, 72 giờ trải nghiệm, teambuilding, thi trạng, hội làng, hội diễn Sao Chổi, sinh nhật FPT, ngày 08/03, ngày 11/11,... Hưởng các gói ưu đãi cước khi sử dụng dịch vụ của FPT Telecom.",,,,"""FPT Telecom Vùng phủ vươn xa, Kết nối mọi nhà"" Xem thêm Thu gọn Tuyển dụng Tất cả tỉnh/thành phố Hà Nội Hồ Chí Minh Bình Dương Bắc Ninh Đồng Nai Hưng Yên Hải Dương Đà Nẵng Hải Phòng An Giang Bà Rịa-Vũng Tàu Bắc Giang Bắc Kạn Bạc Liêu Bến Tre Bình Định Bình Phước Bình Thuận Cà Mau Cần Thơ Cao Bằng Cửu Long Đắk Lắk Đắc Nông Điện Biên Đồng Tháp Gia Lai Hà Giang Hà Nam Hà Tĩnh Hậu Giang Hoà Bình Khánh Hoà Kiên Giang Kon Tum Lai Châu Lâm Đồng Lạng Sơn Lào Cai Long An Miền Bắc Miền Nam Miền Trung Nam Định Nghệ An Ninh Bình Ninh Thuận Phú Thọ Phú Yên Quảng Bình Quảng Nam Quảng Ngãi Quảng Ninh Quảng Trị Sóc Trăng Sơn La Tây Ninh Thái Bình Thái Nguyên Thanh Hoá Thừa Thiên Huế Tiền Giang Toàn Quốc Trà Vinh Tuyên Quang Vĩnh Long Vĩnh Phúc Yên Bái Nước Ngoài Đức Nhật Bản Tìm kiếm 1 /12 trang Xem tất cả việc làm với từ khóa “ ” Thương hiệu lớn tiêu biểu cùng lĩnh vực Pro Company Những thương hiệu tuyển dụng đã khẳng định được vị thế trên thị trường. Công ty Cổ phần Truyền thông IRIS IT - Phần mềm Hệ thống Bán lẻ Viettel store - Công ty TM & XNK Viettel Viễn thông CHI NHÁNH CÔNG TRÌNH VIETTEL BÌNH ĐỊNH - TỔNG CÔNG TY CỔ PHẦN CÔNG TRÌNH VIETTEL Viễn thông Tổng Công ty Mạng lưới Viettel – Chi nhánh Tập đoàn Công nghiệp – Viễn thông Quân đội Viễn thông Viettel IDC Viễn thông Công ty cổ phần Viễn thông VTC Viễn thông Công ty cổ phần tư vấn chuyển giao công nghệ ITC Viễn thông Công ty Cổ phần Viễn thông - Tin học Bưu điện Viễn thông Chi nhánh MOBIFONE SERVICE Hà Nội - Công Ty Cổ phần Dịch vụ kỹ thuật MobiFone Viễn thông Công ty TNHH Phân Phối Synnex FPT IT - Phần mềm Tìm hiểu thêm về TopCV Pro Việc làm “ ” từ các công ty tương tự Thông tin liên hệ Địa chỉ công ty Tầng 2, tòa nhà FPT, Phố Duy Tân, Cầu Giấy, Hà Nội Xem bản đồ Chia sẻ công ty tới bạn bè Sao chép đường dẫn Chia sẻ qua mạng xã hội",
Chuyên Viên Phân Tích Tài Chính (Data Analysis),Chuyên Viên Phân Tích Tài Chính ( Data Analysis ),https://www.topcv.vn/viec-lam/chuyen-vien-phan-tich-tai-chinh-data-analysis/1784960.html?ta_source=JobSearchList_LinkDetail&u_sr_id=P6Zi3k1on4la7LzJKAoJIqJnvqVSOffbE5DvZFFq_1757087864,Công ty Cổ phần Thuận Hải Commodities,Công ty Cổ phần Thuận Hải Commodities,https://www.topcv.vn/cong-ty/cong-ty-co-phan-thuan-hai-commodities/101057.html,https://www.topcv.vn/cong-ty/cong-ty-co-phan-thuan-hai-commodities/101057.html,Thoả thuận,Thoả thuận,Hồ Chí Minh,Hồ Chí Minh,3 năm,3 năm,13/10/2025,Chuyên môn Hoạch định tài chính; Tài chính; Kế toán; Sản xuất,"- Hồ Chí Minh: Lô Vb.20a2, Đường 24, Khu chế xuất Tân Thuận, Phường Tân Thuận Đông, Quận 7",Thứ 2 - Thứ 6 (từ 08:00 đến 17:00); Thứ 7 (từ 08:00 đến 12:00),"Tiếp nhận và tổng hợp dữ liệu từ nhiều nguồn trong Tập đoàn (ERP: Oracle, SAP; Misa, Excel,...), đảm bảo dữ liệu đầy đủ và đồng bộ. Kiểm tra, làm sạch, chuẩn hoá và tích hợp dữ liệu vào Database tập trung; xây dựng, duy trì và tối ưu hóa hệ thống cơ sở dữ liệu. Phân tích dữ liệu hoạt động, tài chính, vận hành,... của các đơn vị trong công ty; phát hiện bất cập, rủi ro và đề xuất đề xuất các khuyến nghị cải tiến. Thiết kế dashboard, báo cáo tự động, đồ thị, biểu đồ trên Power BI nhằm hỗ trợ lãnh đạo ra quyết định nhanh và hiệu quả. Thuyết trình báo cáo phân tích và đóng vai trò tư vấn chiến lược dựa trên dữ liệu cho các cấp quản lý. Phối hợp với các đơn vị liên quan để khảo sát nhu cầu, thu thập yêu cầu nghiệp vụ và đề xuất giải pháp dữ liệu phù hợp. Tham gia hoặc chủ trì triển khai các dự án phân tích dữ liệu và xây dựng báo cáo, đảm bảo chất lượng, đúng tiến độ và tính ứng dụng cao. Liên tục đánh giá và đề xuất các cải tiến trong quy trình thu thập, xử lý và phân tích dữ liệu nhằm nâng cao hiệu suất và chất lượng báo cáo.","1. Tốt nghiệp Đại học trở lên các chuyên ngành Tài chính/ Kế toán và các chuyên ngành liên quan dữ liệu. 2. Có ít nhất 4 năm kinh nghiệm làm Data Analyst các công ty, tập đoàn có kho dữ liệu lớn. (Ưu tiên kinh nghiệm quản lý dữ liệu đa nguồn (dữ liệu sản xuất, kinh doanh, tài chính) 3. Kiến thức tư duy và nền tảng về Tài chính và Kế toán. 4. Công cụ: Excel: Thành thạo power query, power pivot, hiểu biết các hàm thông dụng. SQL/Postgresql cấp độ từ Intermediate. Power BI Desktop: Xử thành thạo Power Query, Dax, Visualized. Python, AI: ứng dụng trong quy trình phân tích dữ liệu là lợi thế (không bắt buộc). 5. Kỹ năng: Tư duy phân tích và logic. Kỹ năng trình bày, lập báo cáo và thuyết phục tốt. Kỹ năng giao tiếp, thuyết trình, làm việc độc lập, làm việc nhóm, giải quyết vấn đề. Kỹ năng quản lý thời gian và ưu tiên công việc. Có khả năng bao quát công việc, chủ động thực hiện công việc trong phạm vi được phân công. Khả năng làm việc dưới áp lực cao và deadline gấp. Khả năng tự học và cập nhật kiến thức mới.","Phụ cấp tiền cơm 30.000 đ / ngày + đài thọ miễn phí cơm trưa Tham gia đầy đủ BHXH theo quy định, bảo hiểm sức khỏe tai nạn 24/24. Thưởng Lễ Tết, thưởng hiệu quả kinh doanh cuối năm (từ 1 – 3 tháng lương tùy vào hoạt động kinh doanh công ty trong năm), lương thâm niên, ... Được trang bị phòng tập gym, yoga hiện đại, cùng thiết bị hỗ trợ công tác tân tiến, xe đưa rước công tác, ... Tham gia các chương trình đào tạo công ty tổ chức để nâng cao kỹ năng & nghiệp vụ. Làm việc tại Thuận Hải – công ty cung cấp giải pháp năng lượng hàng đầu Việt Nam (khối tư nhân), môi trường làm việc chuyên nghiệp cùng rất nhiều tiện ích.",,,,,
Phân Tích Dữ Liệu Kinh Doanh (Data Business Analyst),Phân Tích Dữ Liệu Kinh Doanh (Data Business Analyst ),https://www.topcv.vn/viec-lam/phan-tich-du-lieu-kinh-doanh-data-business-analyst/1862469.html?ta_source=JobSearchList_LinkDetail&u_sr_id=P6Zi3k1on4la7LzJKAoJIqJnvqVSOffbE5DvZFFq_1757087864,Công ty Cổ phần viễn thông FPT,Công ty Cổ phần viễn thông FPT,https://www.topcv.vn/cong-ty/cong-ty-co-phan-vien-thong-fpt/2419.html,https://www.topcv.vn/cong-ty/cong-ty-co-phan-vien-thong-fpt/2419.html,15 - 25 triệu,15 - 25 triệu,Hà Nội,Hà Nội,2 năm,2 năm,05/10/2025,Chuyên môn Data Analyst; IT - Phần mềm; Nghỉ thứ 7,"- Hà Nội: Tòa nhà Detech 2 số 107 Nguyễn Phong Sắc, Cầu Giấy",Thứ 2 - Thứ 6 (từ 08:00 đến 17:30),"Mục tiêu công việc: Phân tích dữ liệu người dùng trên website và ứng dụng thương mại điện tử (ECOM) của FPT Telecom, xây dựng hệ thống pipeline để đo lường user flow, từ đó cung cấp insight nhằm cải thiện trải nghiệm người dùng (UX). Phối hợp chặt chẽ với Growth team để theo dõi, phân tích và đánh giá hiệu quả các chiến dịch marketing, góp phần tối ưu chuyển đổi và tăng trưởng. Nắm bắt kiến thức về AI, LLM, MCP và RAG để chuẩn bị nền tảng cho việc phát triển hệ thống agent thông minh trong tương lai.Thiết kế, triển khai và quản trị data pipeline thu thập & xử lý dữ liệu hành vi người dùng từ website và app ECOM. Phân tích user journey, funnel, retention để phát hiện điểm nghẽn và đưa ra đề xuất tối ưu UX. Xây dựng dashboard và báo cáo trực quan nhằm theo dõi KPI về engagement, retention, conversion. Hỗ trợ Growth team theo dõi, phân tích dữ liệu từ các chiến dịch marketing (digital campaigns, performance ads, email, push notification, v.v.) và đánh giá ROI. Phối hợp với Product Manager, Growth team, UX/UI Designer và Developer để biến insight thành cải tiến sản phẩm và chiến lược tăng trưởng. Thực hiện A/B testing, cohort analysis cho các chiến dịch và luồng người dùng quan trọng. Cập nhật xu hướng AI/LLM, MCP, RAG và đóng góp ý tưởng cho roadmap phát triển hệ thống agent thông minh.","Trình độ tương đương Đại học trở lên chuyên ngành Khoa học Dữ liệu, CNTT, Kinh tế hoặc liên quan. Có 2–3 năm kinh nghiệm trong lĩnh vực Data Analyst, Data Engineer hoặc Business Intelligence. Thành thạo SQL, Python (Pandas, NumPy), ETL pipelines. Biết sử dụng Tableau, Power BI hoặc công cụ visualization tương đương. Kỹ năng phân tích user journey, funnel metrics, A/B testing. Hiểu biết về web/app analytics (Google Analytics, Mixpanel, Amplitude…). Ưu tiên ứng viên có kinh nghiệm trong fintech, trading platform, cloud data platform (AWS, GCP, Azure) và các công cụ như dbt, Airflow, BigQuery, Snowflake. Quan tâm và có kiến thức về AI/ML, LLMs, MCP, RAG là một lợi thế.","Gói thu nhập hấp dẫn theo năng lực (Thưởng lương tháng 13, tiền du lịch nghỉ mát...). Đầy đủ các chế độ theo luật lao động hiện hành. Chính sách phúc lợi theo quy định của Công ty đa dạng: Chăm sóc sức khỏe định kì hàng năm; Gói bảo hiểm sức khỏe chuyên biệt (FPT Care – Khám chữa bệnh miễn phí tại tất cả các bệnh viện); Các hoạt động tri ân, chăm lo đời sống tinh thần CBNV và Thân nhân... Văn hóa Doanh nghiệp đặc sắc, sinh động bậc nhất với nhiều các hoạt động hấp dẫn: tân binh, 72 giờ trải nghiệm, teambuilding, thi trạng, hội làng, hội diễn Sao Chổi, sinh nhật FPT, ngày 08/03, ngày 11/11,... Hưởng các gói ưu đãi cước khi sử dụng dịch vụ của FPT Telecom.",,,,,
Data Analyst,Data Analyst,https://www.topcv.vn/viec-lam/data-analyst/1480809.html?ta_source=JobSearchList_LinkDetail&u_sr_id=P6Zi3k1on4la7LzJKAoJIqJnvqVSOffbE5DvZFFq_1757087864,TẬP ĐOÀN CÔNG NGHIỆP - VIỄN THÔNG QUÂN ĐỘI,TẬP ĐOÀN CÔNG NGHIỆP - VIỄN THÔNG QUÂN ĐỘI,https://www.topcv.vn/cong-ty/tap-doan-cong-nghiep-vien-thong-quan-doi/128588.html,https://www.topcv.vn/cong-ty/tap-doan-cong-nghiep-vien-thong-quan-doi/128588.html,Thoả thuận,Thoả thuận,Hà Nội,Hà Nội,2 năm,2 năm,31/10/2025,Chuyên môn Data Analyst; Nghỉ thứ 7,"- Hà Nội: Tòa Keangnam, Phạm Hùng, Nam Từ Liêm",Thứ 2 - Thứ 6 (từ 08:00 đến 17:30),"Phối hợp với bộ phận Data Scientist và Data Engineer xây dựng các mô hình dữ liệu và báo cáo, phân tích đánh giá kết quả triển khai bài toán phân tích dữ liệu. Xây dựng bộ KPI, cách đo để xác định mức độ thành công của chương trình, dịch vụ hay sản phẩm từ hành vi của khách hàng trên Web/App và các kênh khác (Google Analysis, App Store, Hệ thống quản trị nội bộ, survey người dùng, tương tác mạng xã hội...). Thiết kế, xây dựng các Dashboard, Report cho các đơn vị kinh doanh. Tìm hiểu dữ liệu, thu thập các nguồn dữ liệu, đánh giá và trích xuất các đặc tính dữ liệu. Trực quan hóa các kết quả phân tích dữ liệu. Theo dõi dữ liệu, phân tích kết quả dữ liệu hành vi, xây dựng profile người dùng, dịch vụ, đối tác bằng các công cụ thống kê Tiếp cận dữ liệu từ đa dạng nguồn thông tin và duy trì hệ thống dữ liệu Xác định, phân tích, diễn giải các xu hướng trong một mẫu dữ liệu phức tạp, tìm kiếm các các giá trị dữ liệu Lọc và làm sạch dữ liệu qua các báo cáo, văn bản, và các chỉ số kết quả để điều chỉnh các lỗi code phát sinh.","Tốt nghiệp Đại học loại Khá trở lên từ các chuyên ngành Kinh tế, Khoa học máy tính, và các chuyên ngành liên quan Tiếng Anh tương đương TOEIC 650+ Có ít nhất 02 năm kinh nghiệm làm việc với các mô hình dữ liệu, ưu tiên kinh nghiệm phân tích dữ liệu tài chính, ví điện tử, thương mại điện tử trên mobile Có kinh nghiệm sử dụng các công cụ để thu thập và xử lý dữ liệu. Thành thạo các tác vụ trên các database (SQL) để làm việc với dữ liệu Có kinh nghiệm với ít nhất một trong các công cụ Tableau, Qlik, PowerBI, Google Data Studio. Có kinh nghiệm sử dụng ít nhất một trong hai ngôn ngữ Python, R. Có kinh nghiệm làm việc với Dữ liệu lớn là lợi thế. Nắm vững xác suất thống kê, hiểu biết về học máy là lợi thế.","Thời gian làm việc: 8h00 - 17h30 từ thứ 2 tới thứ 6 Địa điểm làm việc: Làm việc tại tòa nhà văn phòng hạng A cao nhất Thủ đô - Keangnam Landmark 72, Phạm Hùng, Nam Từ Liêm, Hà Nội Mức lương thu hút và cạnh tranh, ứng viên thỏa thuận khi tham gia phỏng vấn Chính sách thưởng hấp dẫn: thưởng năm, ngày lễ Tết, ... theo quy định chung của Tập đoàn Viettel Đóng BHXH, BHYT, BHTN theo quy định Nhà nước; khám sức khỏe định kỳ hàng năm Cơ hội tiếp xúc với các dự án lớn, mới mẻ & tham gia xây dựng những sản phẩm lớn và có chỗ đứng trên thị trường Fintech Việt Nam Cơ hội thăng tiến rõ ràng với nhiều cấp bậc Cơ hội ứng tuyển thử sức đi học tập và làm việc tại nước ngoài theo các khóa ngắn hạn, dài hạn Công việc luôn thay đổi, thách thức, không thỏa hiệp với sự lỗi thời. Lãnh đạo trẻ trung, biết lắng nghe và sẵn sàng tạo cơ hội để cá nhân phát triển bản thân. Đồng nghiệp thân thiện và nhiệt tình. Nghỉ dưỡng 3 ngày nguyên lương trong năm, hỗ trợ nghỉ dưỡng lên đến 9 triệu/ người Tham gia các hoạt động thể thao văn hóa, team building, Ngày hội Sáng tạo, giải bóng đá, Viettel’s Got Talent, event quý, event năm, event ngày nghỉ lễ tết,... Được thư giãn, khơi nguồn sáng tạo với Happy Time mỗi ngày Thưởng thức bữa trưa được phục vụ ngay tại VDS, được chọn lọc bởi các chuyên gia dinh dưỡng.",,,,,
