title,detail_title,job_url,company,company_name_full,company_url,company_url_from_job,salary_list,detail_salary,address_list,detail_location,exp_list,detail_experience,deadline,tags,working_addresses,working_times,desc_mota,desc_yeucau,desc_quyenloi,company_website,company_size,company_industry,company_address,company_description
Phân Tích Nghiệp Vụ (IT Business Analyst) - 2 Năm Kinh Nghiệm - Thu Nhập Cạnh Tranh,Phân Tích Nghiệp Vụ ( IT Business Analyst ) - 2 Năm Kinh Nghiệm - Thu Nhập Cạnh Tranh,https://www.topcv.vn/viec-lam/phan-tich-nghiep-vu-it-business-analyst-2-nam-kinh-nghiem-thu-nhap-canh-tranh/1851292.html?ta_source=JobSearchList_LinkDetail&u_sr_id=P6Zi3k1on4la7LzJKAoJIqJnvqVSOffbE5DvZFFq_1757087864,Công ty TNHH CÔNG NGHỆ VÀ TƯ VẤN DOANH NGHIỆP INNOCOM,Công ty TNHH CÔNG NGHỆ VÀ TƯ VẤN DOANH NGHIỆP INNOCOM,https://www.topcv.vn/cong-ty/cong-ty-tnhh-cong-nghe-va-tu-van-doanh-nghiep-innocom/54179.html,https://www.topcv.vn/cong-ty/cong-ty-tnhh-cong-nghe-va-tu-van-doanh-nghiep-innocom/54179.html,9 - 11 triệu,9 - 11 triệu,Hà Nội,Hà Nội,2 năm,2 năm,30/09/2025,Chuyên môn Data Analyst; IT - Phần mềm; Thương mại điện tử; Viễn thông; Tuổi 23 - 28,"- Hà Nội: Tòa VTC Online - 18 Tam Trinh, Tương Mai, Hoàng Mai",Buổi sáng: Từ 8:30 đến 12:00 Buổi chiều: Từ 13:30 đến 18:00,"- Đánh giá, phân tích tất cả dữ liệu đầu vào từ phía khách hàng (phối hợp cùng bộ phận kỹ thuật) để tìm ra phương án giải quyết trực tiếp vấn đề của khách hàng, cũng như những vấn đề mà khách hàng chưa yêu cầu (hoặc chưa biết) những phần mềm của công ty có thể hỗ trợ, xử lý. - Tư vấn, trình bày cho khách hàng phương án xử lý, giải quyết, cải thiện bằng phần mềm (hoặc các sản phẩm dịch vụ khác của công ty), đề xuất, gợi mở những giải pháp phù hợp khác mà khách hàng nên sử dụng. - Tổng hợp, lên kế hoạch triển khai và phân phối nhiệm vụ đến các bộ phận liên quan, xem xét và chia nhỏ từng task phù hợp với từng giai đoạn của dự án để đảm bảo tiến độ, nhân lực, vật lực của dự án. - Bám sát quá trình triển khai dự án, thúc đẩy dự án hoàn thành đúng thời hạn. - Kiểm tra, kiểm soát chất lượng dự án trước khi bàn giao cho khách hàng.","- Có ít nhất 02 năm kinh nghiệm ở vị trí tương đương. - Ưu tiên UV đã từng theo học hoặc làm việc trong ngành công nghệ, sales B2B. - Sử dụng thành thạo tin học văn phòng, biết sử dụng các loại phần mềm hỗ trợ doanh nghiệp. - Tiếng Anh đọc hiểu, giao tiếp cơ bản. - Kỹ năng phân tích, tổng hợp, trình bày. - Ưu tiên UV theo học hoặc có hiểu biết về lĩnh vực IT.","- Thu nhập: Mức lương từ 9 triệu thỏa thuận theo năng lực khi phỏng vấn. Tổng thu nhập không giới hạn. - Thời gian làm việc: Buổi sáng từ 8:30 đến 12:00, buổi chiều từ 13:30 đến 18:00 - Môi trường làm việc trẻ trung, thân thiện. - Tham gia các hoạt động vui chơi, Happy Hour, du lịch của công ty theo tuần, quý, năm. - BHYT, BHXH, phép năm... đầy đủ theo đúng quy định. - Thưởng tháng T13, thưởng các dịp Lễ - Tết theo chính sách của Công ty.",,,,"VTC Online Building - 18 Tam Trinh, Minh Khai, Hai Bà Trưng & TP. HCM: Jamona Building - 210 Bùi Văn Ba, Tân Thuận Đông, Q7",
Business Analyst (Banking),Business Analyst ( Banking ),https://www.topcv.vn/viec-lam/business-analyst-banking/1812934.html?ta_source=JobSearchList_LinkDetail&u_sr_id=P6Zi3k1on4la7LzJKAoJIqJnvqVSOffbE5DvZFFq_1757087864,SVTECH,SVTECH,https://www.topcv.vn/cong-ty/svtech/2994.html,https://www.topcv.vn/cong-ty/svtech/2994.html,20 - 35 triệu,20 - 35 triệu,Hà Nội,Hà Nội,2 năm,2 năm,15/10/2025,Chuyên môn Phân tích dữ liệu; Ngân hàng; Tài chính; IT - Phần cứng và máy tính; Nghỉ thứ 7; Tiếng Anh TOEIC 650,"- Hà Nội: Tòa nhà IC, số 82 đường Duy Tân, Dịch Vọng Hậu, Cầu Giấy",Thứ 2 - Thứ 6 (từ 08:00 đến 17:30),"Position: Business Analyst (Data Analytics) | 80% BA - 20% DA Dept: Data & Analytics Report to: BA/Data Management Teamleader Your role & responsibilities: Work with source data and MIS system, ensuring clearance, quality, correct content, life cycle and time limits understanding and aligning. Define data flows. The functions of this role are as below: • Performs an analysis of the content, semantics, structures and regulations of data sources objects involved in project • Interacts with the Bank’s specialists on extractions (Bank: ETL (Extraction) and, if necessary, with the Bank’s system architect (Bank: System Expert) • Mapping existing source data to MIS system • Architecture design for enterprise data warehouses • ETL architecture design for enterprise data warehouses • Conduct data SIT and UAT for MIS development","1. Professional Capacity requirements: Bachelor or Master in Banking & Finance or Computer Science or Business Management 2+ years experience in Business Analyst/Data Analyst/MIS role in Banking/Financial Institue Preferred experience in Data warehouse projects/ALM/FTP/… Agile, eager to learn, good communication Have knowledge of and be able to use at least one reporting tool such as: Power BI, Tableau, OBIEE, … English: TOEIC 650 2. Behavioral Competency Requirements: Strong problem-solving skills and effective troubleshooting. Excellent interpersonal communication skills, capable of working efficiently in a team environment when necessary. Attentive, diligent, and hardworking. Curiosity, eagerness to learn, and a passion for technology.","Why choose SVTECH? SVTECH is different in leading the System Integration (SI) market, continuously growing over the past 22 years thanks to special people. Each SVTECHer is given the opportunity to understand himself, confidently promote his strengths to carry out his mission, pursue his passion, and create his own value in the organization and society. 1. Peace of mind with an income policy: Enjoy a competitive salary, attractive bonuses from Company profits and performance (average 15-17 months salary/year). Working allowances, OT. Provide laptops and other necessary tools/accounts/phone cards/tools for work Master your work and enjoy the results. Transparent and frank communication with superiors throughout the working process and annual salary and capacity reviews 2. Career development opportunities: Opportunities to receive training at home and abroad from reputable technology companies in the world: Oracle/IBM, Microsoft… Opportunity to work with Big4 customers. Working with extremely large and diverse data of “Big Corp” – national enterprises in the banking and finance industry, telecommunications, government, and businesses; with international stakeholders – Working according to international, standardized and professional standards Directly deployed for key technology projects. Participate in large projects spanning many diverse fields, work directly with big data systems of telecommunications, banks… interact with leading domestic and international experts. Become a key member of an important strategic department in the next 5-10 years of a top SI company – Many “stages”, many opportunities to experience and explore capabilities, limit yourself and increase value management, advancement opportunities Opportunities for training, unlimited access to resources, official learning materials, and exams for industry-leading certifications. Training budget up to $5000/person/year 2 labs are heavily invested, currently, with diverse equipment located in Hanoi & HCM Invest in training budget, learn in addition to expertise soft skills, leadership, maximum awareness and self-development, coaching… 3. Special benefits are focused on developing Heart, Body and Mind: All SVTECHers are inspired and motivated to live a meaningful, fulfilling life – Heath, Heart, Mind, Spirit Health care: Health insurance for employees and relatives with a limit of $3,000/person; Periodic health check-ups in addition to the government’s Social Insurance policy. Together, we contribute to the community with many values and profound meanings with the Company’s major charity programs every year: building schools, building roads, providing learning equipment for children in highland areas… The budget is heavily focused on improving the spiritual life of individuals and families: Team building, union travel, YEP, Family days, Noel, Halloween, … Diverse playgrounds help you stay healthy with sports clubs: football, badminton, swimming, jogging, yoga, music (Piano, guitar, drums…) 4. Young, enthusiastic environment, many good people and experts in related fields. Likeability, solidarity, trust, listening, respect, care and maximum support from superiors, subordinates, and colleagues – these are qualities that seem to flow implicitly in the core cultural blood of the company. organized and passed down from generation to generation 5. Flexible working policy in terms of time, work location and scope of work according to Agile. About SVTECH: SVTECH – The leading system integration company, providing IT and telecommunications solutions and services in Vietnam Established in 2001 with the business philosophy “Best in the field of operations”, SVTECH is proud to be one of the leading units in system integration and providing ICT services for organizations and businesses. Vietnamese industry. With a team of leading experts in the field, SVTECH focuses on research, implementation, and integration to optimize the operational efficiency of IT and telecommunications infrastructure systems – the core foundation that cannot be replaced in the production process. converting national enterprise numbers. Choose Trust to start every relationship, SVTECH is the most senior strategic partner in Vietnam of the world’s leading IT companies such as Oracle, Juniper, Hitachi, IBM, HP, Dell, NetApp, Redhat, Intel Security… Operating in 03 core areas: System Integration, Cloud Services & Software, SVTECH is honored to be trusted to accompany customers who are large organizations in many fields, national enterprises, typically: Viettel, Mobiphone, Vinaphone, VNPT, ACB, VPBank, Techcombank, Sacombank, Ministry of Finance, Ministry of Natural Resources and Environment, EVN, Sawaco, PVOIL, PVEP, Toyota, Ericsson, National University, RMIT University, Vinamilk, Vingroup, etc. . To meet the constant growth rate, SVTECH is looking for talented candidates to join the professional team.",,,"System Integration, Cloud Services & Software, SVTECH is honored to be trusted to accompany customers who are large organizations in many fields, national enterprises, typically: Viettel, Mobiphone, Vinaphone, VNPT, ACB, VPBank, Techcombank, Sacombank, Ministry of Finance, Ministry of Natural Resources and Environment, EVN, Sawaco, PVOIL, PVEP, Toyota, Ericsson, National University, RMIT University, Vinamilk, Vingroup, etc.. Xem thêm Thu gọn Tuyển dụng Tất cả tỉnh/thành phố Hà Nội Hồ Chí Minh Bình Dương Bắc Ninh Đồng Nai Hưng Yên Hải Dương Đà Nẵng Hải Phòng An Giang Bà Rịa-Vũng Tàu Bắc Giang Bắc Kạn Bạc Liêu Bến Tre Bình Định Bình Phước Bình Thuận Cà Mau Cần Thơ Cao Bằng Cửu Long Đắk Lắk Đắc Nông Điện Biên Đồng Tháp Gia Lai Hà Giang Hà Nam Hà Tĩnh Hậu Giang Hoà Bình Khánh Hoà Kiên Giang Kon Tum Lai Châu Lâm Đồng Lạng Sơn Lào Cai Long An Miền Bắc Miền Nam Miền Trung Nam Định Nghệ An Ninh Bình Ninh Thuận Phú Thọ Phú Yên Quảng Bình Quảng Nam Quảng Ngãi Quảng Ninh Quảng Trị Sóc Trăng Sơn La Tây Ninh Thái Bình Thái Nguyên Thanh Hoá Thừa Thiên Huế Tiền Giang Toàn Quốc Trà Vinh Tuyên Quang Vĩnh Long Vĩnh Phúc Yên Bái Nước Ngoài Đức Nhật Bản Tìm kiếm 1 /12 trang Xem tất cả việc làm với từ khóa “ ” Thương hiệu lớn tiêu biểu cùng lĩnh vực Pro Company Những thương hiệu tuyển dụng đã khẳng định được vị thế trên thị trường. Công ty cổ phần công nghệ - viễn thông Elcom Viễn thông Tổng Công ty Công nghiệp Công nghệ cao Viettel Viễn thông Công ty Cổ phần MediaMart Việt Nam Thương mại điện tử Chi nhánh Công trình Viettel Phú Thọ - Tổng Công ty CP Công trình Viettel Viễn thông Công ty TNHH Phân Phối Synnex FPT IT - Phần mềm Chi nhánh MOBIFONE SERVICE Hà Nội - Công Ty Cổ phần Dịch vụ kỹ thuật MobiFone Viễn thông VIEN SON COMPUTER TECHNOLOGY COMPANY LIMITED IT - Phần cứng Công ty cổ phần tư vấn chuyển giao công nghệ ITC Viễn thông Công ty Cổ phần Thế Giới Số (DIGIWORLD) IT - Phần cứng Công Ty TNHH MTV Viễn Thông Quốc Tế FPT Viễn thông Tìm hiểu thêm về TopCV Pro Việc làm “ ” từ các công ty tương tự Thông tin liên hệ Địa chỉ công ty HCM: 2A Phan Thúc Duyện - P4 - Q Tân Bình; HN: IC Building - 82 Duy Tân - Cầu Giấy Xem bản đồ Chia sẻ công ty tới bạn bè Sao chép đường dẫn Chia sẻ qua mạng xã hội",2A Phan Thúc Duyện - P4 - Q Tân Bình; HN: IC Building - 82 Duy Tân - Cầu Giấy,
Data Analyst,Data Analyst,https://www.topcv.vn/viec-lam/data-analyst/1863583.html?ta_source=JobSearchList_LinkDetail&u_sr_id=P6Zi3k1on4la7LzJKAoJIqJnvqVSOffbE5DvZFFq_1757087864,Công ty TNHH Giải pháp Phân tích dữ liệu Insight Data,Công ty TNHH Giải pháp Phân tích dữ liệu Insight Data,https://www.topcv.vn/cong-ty/cong-ty-tnhh-giai-phap-phan-tich-du-lieu-insight-data/110386.html,https://www.topcv.vn/cong-ty/cong-ty-tnhh-giai-phap-phan-tich-du-lieu-insight-data/110386.html,Tới 20 triệu,Tới 20 triệu,Hà Nội,Hà Nội,2 năm,2 năm,05/10/2025,Chuyên môn Data Analyst; Nghỉ thứ 7,"- Hà Nội: 19 Vũ Trọng Phụng, Thanh Xuân, Thanh Xuân",Thứ 2 - Thứ 6 (từ 08:30 đến 17:30),"Tương tác với các phòng ban để làm rõ yêu cầu nghiệp vụ, yêu cầu phân tích số liệu để tổ chức dữ liệu và xây dựng báo cáo, dashboard liên quan. Thu thập, làm sạch và xử lý dữ liệu từ nhiều nguồn khác nhau theo yêu cầu Phát triển hệ thống báo cáo phục vụ nhu cầu phân tích dữ liệu trên PowerBI Nghiên cứu triển khai và bổ sung các tính năng phù hợp nhu cầu của hệ thống dữ liệu công ty",Bằng cấp/ Chuyên môn nghiệp vụ: Tốt nghiệp đại học chuyên ngành Quản trị kinh doanh/ Kinh tế/ Tài chính/ Marketing hoặc các ngành liên quan kinh tế Từ 2 năm kinh nghiệm Ưu tiên đã có kinh nghiệm 1 trong các domain sau: F&B hoặc Retail hoặc Ecommerce hoặc FMCG Thành thạo PowerBI Tiếng Anh: Đọc hiểu tài liệu,"Mức lương cạnh tranh theo năng lực & Thưởng performance, 13 tháng lương Đóng bảo hiểm theo luật lao động Việt Nam (BHXH, BHYT, BHTN) Thưởng vào các dịp lễ khác trong năm (1/1, 30/4-1/5; 2/9, 8/3, 20/10...), Sinh nhật; Chi phí công đoàn thăm hỏi vào các dịp hiếu, hỉ, ốm đau; Phụ cấp gửi xe; ngoài ra phụ cấp điện thoại và đi lại tùy thuộc vào một số vị trí và cấp bậc; Phụ cấp cơm trưa, bảo hiểm sức khỏe, khám sức khỏe định kỳ 1 lần/năm, du lịch nghỉ mát 1 lần/ năm. Được đào tạo và trau dồi không chỉ kiến thức chuyên môn, kỹ năng mềm mà cả kỹ năng quản lý nhóm, quản lý dự án thông qua các buổi đào tạo nội bộ chung do phòng Đào tạo tổ chức hoặc các buổi đào tạo của riêng phòng ban; Môi trường làm việc chuyên nghiệp, trẻ trung, năng động Review công việc định kỳ Được đào tạo, lộ trình thăng tiến rõ ràng Nghỉ Thứ 7, Chủ nhật, 12 ngày phép/năm Company trip, team-building,... Happy hours hàng tháng, free snacks, hoa quả, đồ uống,..","inda.vn), là một trong những doanh nghiệp hàng đầu trong lĩnh vực Công nghệ thông tin, đi tiên phong trong việc cung cấp các giải pháp chuyển đổi số cho doanh nghiệp. Insight Data hoạt động trong nhiều lĩnh vực: Cung cấp giải pháp tích hợp cho hệ thống CNTT; Cung cấp dịch vụ triển khai kho dữ liệu; Dịch vụ outsourcing - cho thuê nhân sự ngành Data, cung cấp bản quyền phần mềm chính hãng và Dịch vụ đào tạo toàn diện phù hợp với mọi phòng ban trong doanh nghiệp,... Được đánh giá là một trong những công ty hàng đầu trong lĩnh vực tích hợp giải pháp CNTT quy mô lớn, Insight Data đang trên đà phát triển vươn lên tầm khu vực lẫn toàn thế giới. Mang trong mình nhiều tiềm lực cũng như khả năng bắt kịp xu thế nhanh chóng và mạnh mẽ, Insight Data đã và đang cùng với đối tác triển khai nhiều dự án quan trọng của các ngân hàng lớn như VPBank, Seabank, Techcombank, Sacombank, WorldBank, .... Insight Data là đối tác tin cậy của nhiều tập đoàn hàng đầu thế giới như Masan, Đạm Phú Mỹ, Novaland, Mutosi, PTI,..... Xem thêm Thu gọn Tuyển dụng Tất cả tỉnh/thành phố Hà Nội Hồ Chí Minh Bình Dương Bắc Ninh Đồng Nai Hưng Yên Hải Dương Đà Nẵng Hải Phòng An Giang Bà Rịa-Vũng Tàu Bắc Giang Bắc Kạn Bạc Liêu Bến Tre Bình Định Bình Phước Bình Thuận Cà Mau Cần Thơ Cao Bằng Cửu Long Đắk Lắk Đắc Nông Điện Biên Đồng Tháp Gia Lai Hà Giang Hà Nam Hà Tĩnh Hậu Giang Hoà Bình Khánh Hoà Kiên Giang Kon Tum Lai Châu Lâm Đồng Lạng Sơn Lào Cai Long An Miền Bắc Miền Nam Miền Trung Nam Định Nghệ An Ninh Bình Ninh Thuận Phú Thọ Phú Yên Quảng Bình Quảng Nam Quảng Ngãi Quảng Ninh Quảng Trị Sóc Trăng Sơn La Tây Ninh Thái Bình Thái Nguyên Thanh Hoá Thừa Thiên Huế Tiền Giang Toàn Quốc Trà Vinh Tuyên Quang Vĩnh Long Vĩnh Phúc Yên Bái Nước Ngoài Đức Nhật Bản Tìm kiếm 1 /12 trang Xem tất cả việc làm với từ khóa “ ” Thương hiệu lớn tiêu biểu cùng lĩnh vực Pro Company Những thương hiệu tuyển dụng đã khẳng định được vị thế trên thị trường. Công ty Cổ phần Hệ thống Công nghệ ETC IT - Phần mềm Tập đoàn công nghệ CMC IT - Phần mềm TỔNG CÔNG TY CỔ PHẦN BƯU CHÍNH VIETTEL IT - Phần mềm CÔNG TY TNHH MITEK VIỆT NAM Xây dựng CÔNG TY CỔ PHẦN MÁY TÍNH VĨNH XUÂN IT - Phần mềm CÔNG TY CỔ PHẦN DỊCH VỤ CÔNG NGHỆ TIN HỌC HPT IT - Phần mềm FPT Software IT - Phần mềm CÔNG TY TNHH SAMSUNG SDS VIỆT NAM IT - Phần mềm Công ty Cổ phần Đầu tư và Công nghệ HTI IT - Phần mềm Tổng Công ty Công nghiệp Công nghệ cao Viettel Viễn thông Tìm hiểu thêm về TopCV Pro Việc làm “ ” từ các công ty tương tự Thông tin liên hệ Địa chỉ công ty Tầng 5, Tòa A, 47 Nguyễn Tuân, Thanh xuân, Hà Nội Xem bản đồ Chia sẻ công ty tới bạn bè Sao chép đường dẫn Chia sẻ qua mạng xã hội",,,,
Chuyên Viên Báo Cáo - Trung Tâm Thẻ,Chuyên Viên Báo Cáo - Trung Tâm Thẻ,https://www.topcv.vn/viec-lam/chuyen-vien-bao-cao-trung-tam-the/1863452.html?ta_source=JobSearchList_LinkDetail&u_sr_id=P6Zi3k1on4la7LzJKAoJIqJnvqVSOffbE5DvZFFq_1757087864,NGÂN HÀNG THƯƠNG MẠI CỔ PHẦN NAM Á (NAM A BANK),NGÂN HÀNG THƯƠNG MẠI CỔ PHẦN NAM Á (NAM A BANK),https://www.topcv.vn/cong-ty/ngan-hang-thuong-mai-co-phan-nam-a-nam-a-bank/161332.html,https://www.topcv.vn/cong-ty/ngan-hang-thuong-mai-co-phan-nam-a-nam-a-bank/161332.html,Thoả thuận,Thoả thuận,Hồ Chí Minh,Hồ Chí Minh,2 năm,2 năm,05/10/2025,Chuyên môn Phân tích dữ liệu; Ngân hàng; Tài chính; Nghỉ thứ 7,"- Hồ Chí Minh: 201 - 203 Cách Mạng Tháng Tám, Phường Bàn Cờ, Quận 3",Thứ 2 - Thứ 6 (từ 08:00 đến 17:00),"Nghiên cứu & phát triển sản phẩm: Thu thập insight khách hàng, phân tích xu hướng thị trường, sản phẩm đối thủ. Tham gia xây dựng, cải tiến sản phẩm thẻ tín dụng theo phân khúc mục tiêu. Đề xuất các tính năng, chính sách, ưu đãi phù hợp với chiến lược kinh doanh. Phát triển & quản trị hệ thống báo cáo: Thiết kế và triển khai hệ thống báo cáo quản trị (MIS) phục vụ theo dõi KPIs: phát hành, sử dụng, doanh số, dư nợ, nợ xấu, hiệu quả chiến dịch. Xây dựng dashboard trực quan (Power BI/ Tableau/ Excel nâng cao) phục vụ Ban Lãnh đạo và các đơn vị kinh doanh. Tự động hóa các báo cáo định kỳ, giảm thiểu thao tác thủ công. Phân tích dữ liệu để phát hiện vấn đề, cơ hội tăng trưởng và đề xuất giải pháp. Phối hợp & hỗ trợ: Làm việc chặt chẽ với Khối CNTT, Kinh doanh, Marketing, Rủi ro để đảm bảo dữ liệu báo cáo chính xác, kịp thời. Hỗ trợ đào tạo, hướng dẫn đơn vị kinh doanh khai thác hệ thống báo cáo. Thực hiện các nhiệm vụ khác theo phân công của quản lý trực tiếp.","Tốt nghiệp đại học các ngành: Kinh tế, Tài chính – Ngân hàng, Thống kê, Toán kinh tế, Công nghệ thông tin hoặc liên quan. Kinh nghiệm: Ít nhất 2 năm trong lĩnh vực phân tích dữ liệu/ MIS/ báo cáo kinh doanh, ưu tiên trong ngân hàng hoặc tổ chức tài chính. Có hiểu biết về sản phẩm thẻ tín dụng hoặc sản phẩm bán lẻ ngân hàng là lợi thế. Kỹ năng: Thành thạo Excel nâng cao, SQL; ưu tiên biết Power BI/ Tableau. Kỹ năng phân tích dữ liệu, lập báo cáo và trình bày kết quả. Khả năng tư duy logic, chi tiết và cẩn thận. Giao tiếp, phối hợp tốt giữa nhiều phòng ban. Tiếng Anh: Đọc hiểu tài liệu chuyên ngành.","Bảo đảm công việc ổn định lâu dài, nhiều tình huống thử thách tính năng động và sáng tạo, phát huy tối đa năng lực bản thân, có cơ hội thăng tiến, phát triển sự nghiệp. Môi trường và điều kiện làm việc tốt, đầy đủ phương tiện, thiết bị; Đồng nghiệp thân thiện, sẵn sàng giúp đỡ, hỗ trợ; Đánh giá và trả lương theo năng lực, thưởng hấp dẫn. Được hưởng đầy đủ các chế độ đãi ngộ theo Luật Lao động Việt Nam (BHXH, BHYT…); Được tham gia các chương trình đào tạo nội bộ và bên ngoài",,,,"201-203 Cách Mạng Tháng Tám, Phường 4, Quận 3, Thành phố Hồ Chí Minh, Việt Nam Xem thêm Thu gọn Tuyển dụng Tất cả tỉnh/thành phố Hà Nội Hồ Chí Minh Bình Dương Bắc Ninh Đồng Nai Hưng Yên Hải Dương Đà Nẵng Hải Phòng An Giang Bà Rịa-Vũng Tàu Bắc Giang Bắc Kạn Bạc Liêu Bến Tre Bình Định Bình Phước Bình Thuận Cà Mau Cần Thơ Cao Bằng Cửu Long Đắk Lắk Đắc Nông Điện Biên Đồng Tháp Gia Lai Hà Giang Hà Nam Hà Tĩnh Hậu Giang Hoà Bình Khánh Hoà Kiên Giang Kon Tum Lai Châu Lâm Đồng Lạng Sơn Lào Cai Long An Miền Bắc Miền Nam Miền Trung Nam Định Nghệ An Ninh Bình Ninh Thuận Phú Thọ Phú Yên Quảng Bình Quảng Nam Quảng Ngãi Quảng Ninh Quảng Trị Sóc Trăng Sơn La Tây Ninh Thái Bình Thái Nguyên Thanh Hoá Thừa Thiên Huế Tiền Giang Toàn Quốc Trà Vinh Tuyên Quang Vĩnh Long Vĩnh Phúc Yên Bái Nước Ngoài Đức Nhật Bản Tìm kiếm 1 /12 trang Xem tất cả việc làm với từ khóa “ ” Thương hiệu lớn tiêu biểu cùng lĩnh vực Pro Company Những thương hiệu tuyển dụng đã khẳng định được vị thế trên thị trường. Công ty cổ phần đầu tư BKG Việt Nam Sản xuất GENERALI VIETNAM Bảo hiểm Công ty cổ phần chứng khoán FPT Chứng khoán Ngân Hàng TNHH MTV Shinhan Việt Nam Ngân hàng Công ty TNHH một thành viên Tổng Công ty Sản xuất thiết bị Viettel Tài chính CÔNG TY TÀI CHÍNH TRÁCH NHIỆM HỮU HẠN MỘT THÀNH VIÊN SHINHAN VIỆT NAM - CHI NHÁNH BÌNH DƯƠNG Tài chính Công ty CPDV Trực tuyến Cộng Đồng Việt (VietUnion) Tài chính Công ty cổ phần Tasco Bất động sản Ngân hàng TMCP Hàng Hải Việt Nam (MSB) Ngân hàng NGÂN HÀNG THƯƠNG MẠI CỔ PHẦN QUÂN ĐỘI - CHI NHÁNH BẮC SÀI GÒN Ngân hàng Tìm hiểu thêm về TopCV Pro Việc làm “ ” từ các công ty tương tự Thông tin liên hệ Địa chỉ công ty 201-203 Cách Mạng Tháng Tám, Phường Bàn Cờ, Thành phố Hồ Chí Minh, Việt Nam Xem bản đồ Chia sẻ công ty tới bạn bè Sao chép đường dẫn Chia sẻ qua mạng xã hội",
