title,detail_title,job_url,company,company_name_full,company_url,company_url_from_job,salary_list,detail_salary,address_list,detail_location,exp_list,detail_experience,deadline,tags,working_addresses,working_times,desc_mota,desc_yeucau,desc_quyenloi,company_website,company_size,company_industry,company_address,company_description
Operations Analyst,Operations Analyst,https://www.topcv.vn/viec-lam/operations-analyst/1862011.html?ta_source=JobSearchList_LinkDetail&u_sr_id=P6Zi3k1on4la7LzJKAoJIqJnvqVSOffbE5DvZFFq_1757087864,Công ty Cổ phần Dịch vụ Tức Thời (Ahamove),Công ty Cổ phần Dịch vụ Tức Thời (Ahamove),https://www.topcv.vn/cong-ty/cong-ty-co-phan-dich-vu-tuc-thoi-ahamove/22.html,https://www.topcv.vn/cong-ty/cong-ty-co-phan-dich-vu-tuc-thoi-ahamove/22.html,Thoả thuận,Thoả thuận,Hồ Chí Minh,Hồ Chí Minh,2 năm,2 năm,04/10/2025,Chuyên môn Phân tích dữ liệu; Thương mại điện tử; Logistic / Vận tải; Bán lẻ - Hàng tiêu dùng - FMCG; Nghỉ thứ 7,"- Hồ Chí Minh: 7/28 Thành Thái, Quận 10",Thứ 2 - Thứ 6 (từ 08:30 đến 18:00),"1. Reporting & Data Analysis (40%) Develop and maintain data-mart systems to support performance reporting and policy evaluation. Design and build dashboards based on business requirements (e.g., Metabase, Data Studio). Collaborate with departments to standardize metric definitions and ensure data consistency across teams. Automate recurring data report flows (daily/weekly/monthly) 2. Performance Evaluation & Experimentation (30%) Coordinate with specialized teams to design policy experiments (e.g., A/B tests, canary launches, regional/user-based pilots). Analyze experimental results using quantitative methods (e.g., lift, uplift, ROI, retention impact). Provide data-driven recommendations for policy or operational decision-making. 3. Knowledge & Documentation (30%) Standardize and maintain documentation related to reporting systems, data-marts, experiment logic, and dashboard usage guides. Establish knowledge repositories, checklists, and internal wikis for data practices and analytical methodologies. Collaborate with team members to ensure knowledge transfer, cross-departmental learning, and proper training.","Bachelor’s degree in Data Analytics, Information Systems, Statistics, Economics, or related fields. Minimum of 2 years of experience in data analysis and building reporting systems. Proficient in SQL and analytical tools such as BigQuery, Metabase, Google Sheets; familiarity with Python or R is a plus. Experience with Data Warehousing, Data-mart structures, and ETL processes. Strong understanding of A/B testing, causal inference, and effectiveness modeling. Ability to present and visualize data clearly and intuitively. Strong skills in documentation, knowledge sharing, and process communication. Systematic thinking, attention to detail, and a mindset for continuous improvement. Proactive, capable of cross-functional collaboration and handling multiple projects simultaneously.","Social Insurance & Generali Health Insurance. Annual health check at a reputable hospital. Annual travel, team building, year-end party. Annual Performance Bonus. Excellent and competitive salary with 13th-month salary. Startup environment, young, dynamic, work hard, play hard. Working time: 5 days/week and flexible according to job positions. Location: 7/28 Thanh Thai str, Ward 14, District 10, HCMC.",,,,,
Chuyên Viên Dữ Liệu (Data Engineer),Chuyên Viên Dữ Liệu ( Data Engineer ),https://www.topcv.vn/viec-lam/chuyen-vien-du-lieu-data-engineer/1861439.html?ta_source=JobSearchList_LinkDetail&u_sr_id=P6Zi3k1on4la7LzJKAoJIqJnvqVSOffbE5DvZFFq_1757087864,Công ty cổ phần đầu tư KD,Công ty cổ phần đầu tư KD,https://www.topcv.vn/cong-ty/cong-ty-co-phan-dau-tu-kd/6437.html,https://www.topcv.vn/cong-ty/cong-ty-co-phan-dau-tu-kd/6437.html,Thoả thuận,Thoả thuận,Hà Nội,Hà Nội,3 năm,3 năm,04/10/2025,Chuyên môn Data Engineer; IT - Phần cứng và máy tính,"- Hà Nội: Toà nhà KDI Holdings, 16 Nguyễn Công Trứ, Phạm Đình Hổ, Hai Bà Trưng, Hà Nộ, Hai Bà Trưng",Thứ 2 - Thứ 6 (từ 08:30 đến 18:00); Theo thời gian của Lãnh đạo,Xây dựng và quản lý cơ sở dữ liệu Xử lý các vấn đề liên quan đến tích hợp dữ liệu Triển khai các biện pháp bảo mật dữ liệu Phát triển và duy trì các pipeline ETL Tham gia lập kế hoạch nâng cấp hạ tầng CNTT Hỗ trợ triển khai công cụ báo cáo Đảm bảo các hệ thống CNTT hoạt động đồng bộ,"Bằng đại học chuyên ngành CNTT, Khoa học dữ liệu hoặc tương đương Thành thạo SQL và các hệ quản trị cơ sở dữ liệu Kiến thức về ETL, data warehouse và data lake Hiểu biết về các công nghệ Big Data Tối thiểu 3 năm kinh nghiệm làm việc với dữ liệu Kinh nghiệm thiết kế và triển khai cơ sở dữ liệu Kinh nghiệm phát triển quy trình ETL Kinh nghiệm làm việc với các công cụ xử lý dữ liệu Kỹ năng lập trình và xử lý dữ liệu Kỹ năng tối ưu hóa hiệu suất cơ sở dữ liệu Kỹ năng giải quyết vấn đề và phân tích Kỹ năng làm việc nhóm và giao tiếp","Chế độ Phúc lợi (BHXH, 12 ngày phép/năm, thưởng các ngày Lễ...) theo quy định Nhà nước. Cơ hội được tham gia tất cả các khóa phát triển cá nhân do Công ty tổ chức và các khóa đào tạo bên ngoài nhằm phát triển chuyên môn và kỹ năng cần thiết. Được làm việc trong môi trường năng động, hưởng đầy đủ các chế độ BHXH, BHYT, BHTN, Thưởng 13... và các phúc lợi khác theo quy định của Luật lao động và của Công ty. Được đi du lịch và tham gia các hoạt động vui chơi, giải trí khác do Tập đoàn tổ chức hàng quý, hàng năm. Khám sức khỏe định kỳ Môi trường thân thiện, năng động.. Hỗ trợ Công cụ làm việc.",,,,,
Performance Marketing Lead (Data Analysis),Performance Marketing Lead ( Data Analysis ),https://www.topcv.vn/viec-lam/performance-marketing-lead-data-analysis/1717704.html?ta_source=JobSearchList_LinkDetail&u_sr_id=P6Zi3k1on4la7LzJKAoJIqJnvqVSOffbE5DvZFFq_1757087864,CÔNG TY TNHH TRUYỀN THÔNG PHÚ CƯỜNG SOLUTION,CÔNG TY TNHH TRUYỀN THÔNG PHÚ CƯỜNG SOLUTION,https://www.topcv.vn/cong-ty/cong-ty-tnhh-truyen-thong-phu-cuong-solution/88690.html,https://www.topcv.vn/cong-ty/cong-ty-tnhh-truyen-thong-phu-cuong-solution/88690.html,Thoả thuận,Thoả thuận,Hồ Chí Minh,Hồ Chí Minh,2 năm,2 năm,31/10/2025,Chuyên môn Market Research and Analysis khác; IT - Phần mềm; Thương mại điện tử; Marketing / Quảng cáo,"- Hồ Chí Minh: Tòa Nhà The Sun, Số 8 Đường 66 Thảo Điền, Quận 2",Thứ 2 - Thứ 6 (từ 08:30 đến 18:00); Thứ 2- thứ 6: 8h30-18h Thứ bảy: 8h30-12h ( wfh),"1. Triển khai chiến dịch quảng cáo (50%): Thực hiện và theo dõi các chiến dịch quảng cáo trên Facebook, Google, Tik Tok, Instagram,... cho các khách hàng thương hiệu F&B Mở rộng hợp tác với các đối tác công nghệ để đảm bảo được các mục tiêu tăng trưởng toàn diện. Quản lý và phân bổ ngân sách quảng cáo dựa trên phân tích hiệu quả đầu tư. 2. Phân tích hiệu quả & báo cáo 25%): Theo dõi và phân tích chỉ số cơ bản (CPM, CPC, CTR, CPA), cập nhật báo cáo kết quả hàng tuần và đề xuất tối ưu hóa ngân sách. Nghiên cứu thị trường online, hiểu hành vi thị trường và lợi thế cạnh tranh. 3. Quản Lý Team (15%): Quản lý hướng dẫn 2–3 bạn intern/junior, đào tạo giúp nâng cao kỹ năng (phân tích dữ liệu, chạy ads…) của thành viên Thiết lập KPI và theo dõi hiệu suất của các thành viên trong team 4. Tham gia xây dựng quy trình dashboard và quản trị data (10%): Làm việc cùng team để xây dựng dashboard theo dõi các chỉ số quan trọng và báo cáo tự động Thiết kế hệ thống thu thập và quản lý dữ liệu hiệu quả cho hoạt động quảng cáo Xây dựng quy trình đánh giá và phân tích dữ liệu chuẩn cho ngành F&B Quản lý tài nguyên quảng cáo: BM, Via,...","Từ trên 2 năm kinh nghiệm trong lĩnh vực digital marketing trong lĩnh vực F&B hoặc ngành tương đương. Khả năng phân tích số liệu cơ bản từ Ads Manager và trình bày logic qua báo cáo. Có kinh nghiệm làm việc nhóm, từng quản lý team nhỏ hoặc từng hướng dẫn đồng đội junior. Biết sử dụng Google Sheet, Excel, Power BI, AI analytics… để tính toán, báo cáo. Là người kỷ luật, chủ động, chịu khó học hỏi và cập nhật xu hướng quảng cáo.","Lương: thỏa thuận trong thời gian phỏng vấn. Thưởng phúc lợi theo quý. Thưởng phúc lợi theo năm. Tham gia các hoạt động công ty sôi nổi như: Team building, Sinh nhật thành viên, Workshop, sharing kiến thức trong ngành. Được WFH 5 lần/ tháng ( nhận 80% lương) Nghỉ phép năm 12 ngày. Làm việc trong môi trường trẻ năng động - Gen Z",,,"Fitmar Agency là một công ty chuyên cung cấp dịch vụ Digital marketing đa kênh cho các doanh nghiệp trong lĩnh vực F&B, thời trang, bán lẻ với sứ mệnh đồng hành lâu dài và hướng tới giá trị chuyển đổi số bền vững. Đội ngũ nhân lực trẻ trung và nhiệt huyết với giá trị văn hoá cốt lõi: F (Flexibility) I (Innovative), T (Transcendent), hứa hẹn là môi trường lý tưởng để phát triển cùng lộ trình thăng tiến rõ ràng, minh bạch, cân bằng giữa chuyên môn năng lực và kỹ năng mềm để phá bỏ các giới hạn an toàn và phát triển thành những chuyên gia trong lĩnh vực marketing. Thông tin truy cập: - https://fitmar.vn/ - https://www.tiktok.com/@fitmar.agency?_t=8XQ7eyom0UU&_r=1 - http://www.facebook.com/fitmaragency Tầm nhìn và sứ mệnh: Đồng hành cùng doanh nghiệp vừa và nhỏ với mục tiêu tối ưu chi phí và tăng trưởng doanh thu thông qua các nền tảng chuyển đổi số. Đối với khách hàng: Hỗ trợ vận hành, giám sát, cố vấn chiến lược, thấu hiểu thị trường và tư duy ngành hàng, tạo giá trị và đem lại sự hài lòng, Đối với người tiêu dùng: tạo giá trị cho nền kinh tế số Việt Nam, lan tỏa những sản phẩm dịch vụ tốt đến tay người tiêu dùng. Đối với nhân viên: Tạo ra môi trường phát huy năng lực tư duy, Giúp nhân sự hoàn thiện TRÍ TUỆ - NGHỊ LỰC, tạo ra giá trị cho tổ chức và xã hội. Một tập thể được lắng nghe và tôn trọng, thấu hiểu bản thân, cải tiến quy trình, cải tiến năng lực và tầm nhìn liên tục để có thể phục vụ sứ mệnh tốt đẹp cho nền kinh tế số Việt Nam. Xem thêm Thu gọn Tuyển dụng Tất cả tỉnh/thành phố Hà Nội Hồ Chí Minh Bình Dương Bắc Ninh Đồng Nai Hưng Yên Hải Dương Đà Nẵng Hải Phòng An Giang Bà Rịa-Vũng Tàu Bắc Giang Bắc Kạn Bạc Liêu Bến Tre Bình Định Bình Phước Bình Thuận Cà Mau Cần Thơ Cao Bằng Cửu Long Đắk Lắk Đắc Nông Điện Biên Đồng Tháp Gia Lai Hà Giang Hà Nam Hà Tĩnh Hậu Giang Hoà Bình Khánh Hoà Kiên Giang Kon Tum Lai Châu Lâm Đồng Lạng Sơn Lào Cai Long An Miền Bắc Miền Nam Miền Trung Nam Định Nghệ An Ninh Bình Ninh Thuận Phú Thọ Phú Yên Quảng Bình Quảng Nam Quảng Ngãi Quảng Ninh Quảng Trị Sóc Trăng Sơn La Tây Ninh Thái Bình Thái Nguyên Thanh Hoá Thừa Thiên Huế Tiền Giang Toàn Quốc Trà Vinh Tuyên Quang Vĩnh Long Vĩnh Phúc Yên Bái Nước Ngoài Đức Nhật Bản Tìm kiếm 1 /12 trang Xem tất cả việc làm với từ khóa “ ” Thương hiệu lớn tiêu biểu cùng lĩnh vực Pro Company Những thương hiệu tuyển dụng đã khẳng định được vị thế trên thị trường. CÔNG TY CỔ PHẦN CLEVERADS Marketing / Truyền thông / Quảng cáo CÔNG TY CỔ PHẦN TẬP ĐOÀN YEAH1 Marketing / Truyền thông / Quảng cáo CÔNG TY CỔ PHẦN TẬP ĐOÀN PELIO Nhà hàng / Khách sạn BÁO ĐIỆN TỬ VNEXPRESS.NET Marketing / Truyền thông / Quảng cáo Công ty Cổ phần Thế Giới Số (DIGIWORLD) IT - Phần cứng Công ty Cổ phần Xe khách Phương Trang Futa Bus Lines Logistics - Vận tải Chi nhánh Công Trình Viettel Cao Bằng - Viettel Construction Viễn thông Ban Quản Lý TTTM Crescent Mall Nhà hàng / Khách sạn CHI NHÁNH CÔNG TRÌNH VIETTEL HÀ TĨNH - TỔNG CÔNG TY CỔ PHẦN CÔNG TRÌNH VIETTEL Viễn thông CÔNG TY CỔ PHẦN CHỨNG KHOÁN VPS - CHI NHÁNH THÀNH PHỐ HỒ CHÍ MINH Chứng khoán Tìm hiểu thêm về TopCV Pro Việc làm “ ” từ các công ty tương tự Thông tin liên hệ Địa chỉ công ty The Sun Building, số 8 đường 66, Thảo Điền, Quận 2 Xem bản đồ Chia sẻ công ty tới bạn bè Sao chép đường dẫn Chia sẻ qua mạng xã hội",,
Nhân Viên Công Nghệ Thông Tin (Mới Ra Trường),Nhân Viên Công Nghệ Thông Tin (Mới Ra Trường),https://www.topcv.vn/viec-lam/nhan-vien-cong-nghe-thong-tin-moi-ra-truong/1860449.html?ta_source=JobSearchList_LinkDetail&u_sr_id=P6Zi3k1on4la7LzJKAoJIqJnvqVSOffbE5DvZFFq_1757087864,CÔNG TY CỔ PHẦN DƯỢC PHẨM VĨNH PHÚC,CÔNG TY CỔ PHẦN DƯỢC PHẨM VĨNH PHÚC,https://www.topcv.vn/cong-ty/cong-ty-co-phan-duoc-pham-vinh-phuc/199050.html,https://www.topcv.vn/cong-ty/cong-ty-co-phan-duoc-pham-vinh-phuc/199050.html,Thoả thuận,Thoả thuận,Vĩnh Phúc,Vĩnh Phúc,Không yêu cầu,Không yêu cầu,04/10/2025,Chuyên môn Data Analyst; IT - Phần mềm,- Vĩnh Phúc,,"• Thu thập dữ liệu Master Data, tạo mới/chỉnh sửa dữ liệu Master Data trên hệ thống SAP. • Tư vấn, trả lời end-user về các dữ liệu Master Data trên hệ thống SAP • Phát triển các tool upload dữ liệu Master Data theo yêu cầu của phòng CNTT • Hỗ trợ CNTT cho người dùng cuối • Tham gia dự án SAP theo giai đoạn và phân công của TP CNTT","- Bằng cấp, trình độ: cao đẳng hoặc đại học chính quy - Kiến thức: + Sử dụng tốt Excel, các hàm tính toán trong Excel. Biết VBA là 1 lợi thế + Kiến thức về hỗ trợ CNTT - Kỹ năng: + Giao tiếp, tương tác với người dùng cuối. + Giải quyết vấn đề và ra quyết định. + Kỹ năng làm việc độc lập. - Thái độ: + Có trách nhiệm với công việc, làm việc nghiêm túc, nhanh nhẹn, nhiệt tình, khả năng làm việc độc lập cao, sẵn sàng học hỏi tiếp thu các kiến thức, khái niệm mới. + Nhanh nhẹn, chăm chỉ, ham học hỏi, thân thiện, trách nhiệm cao trong công việc.","Tiền lương, đãi ngộ hấp dẫn theo năng lực và khả năng đóng góp của cá nhân (thỏa thuận trong quá trình phỏng vấn). Lương tháng 13, thưởng theo kết quả hoạt động sản xuất kinh doanh. Xét tăng lương, thưởng các ngày lễ lớn trong năm lên tới hơn 1.000.000 đồng/ngày. Được tham gia BHXH, BHYT, BHTN và các chế độ khác theo quy định của Công ty và pháp luật Nhà nước. Được hỗ trợ, tạo điều kiện để nâng cao năng lực, kiến thức chuyên môn. Hỗ trợ ăn ca, thăm quan, du lịch hàng năm. Tham gia các hoạt động, event 20/10, 8/03, sinh nhật công ty,… của Công ty.",,,,,
Nhân Viên Tư Vấn Giải Pháp Phần Mềm,Nhân Viên Tư Vấn Giải Pháp Phần Mềm,https://www.topcv.vn/viec-lam/nhan-vien-tu-van-giai-phap-phan-mem/1810584.html?ta_source=JobSearchList_LinkDetail&u_sr_id=P6Zi3k1on4la7LzJKAoJIqJnvqVSOffbE5DvZFFq_1757087864,Công ty CP Đầu tư Thương mại và Phát triển Công nghệ FSI - CN HCM,Công ty CP Đầu tư Thương mại và Phát triển Công nghệ FSI - CN HCM,https://www.topcv.vn/cong-ty/cong-ty-cp-dau-tu-thuong-mai-va-phat-trien-cong-nghe-fsi-cn-hcm/199028.html,https://www.topcv.vn/cong-ty/cong-ty-cp-dau-tu-thuong-mai-va-phat-trien-cong-nghe-fsi-cn-hcm/199028.html,16 - 20 triệu,16 - 20 triệu,Hồ Chí Minh,Hồ Chí Minh,2 năm,2 năm,03/10/2025,Chuyên môn Phân tích dữ liệu; An ninh mạng; IT - Phần cứng và máy tính,"- Hồ Chí Minh: 26/22 Đường số 3, Cư xá Đô Thành, Phường 4, Quận 3",Thứ 2 - Thứ 6 (từ 08:00 đến 17:00); Thứ 7 tuần 2 và tuần 4 làm online,"- Trước khi Ký Hợp Đồng: o Khảo sát, làm rõ yêu cầu nghiệp vụ của khách hàng, thu thập thông tin và dữ liệu cần thiết. o Phân tích nghiệp vụ (Business Analysis), mô hình hóa quy trình hiện tại và đề xuất quy trình mới tối ưu. o Thiết kế và xây dựng các giải pháp phần mềm (ứng dụng, hệ thống quản lý, AI, Big Data, IoT) đáp ứng yêu cầu. o Soạn thảo tài liệu đặc tả yêu cầu nghiệp vụ (URS), thiết kế giải pháp phần mềm, hồ sơ kỹ thuật thầu. o Chuẩn bị và trình bày giải pháp phần mềm cho khách hàng, tập trung vào giá trị nghiệp vụ. o Lập kế hoạch triển khai dự án phần mềm (giai đoạn phân tích, thiết kế, phát triển, kiểm thử, đào tạo). o Tổng hợp tài liệu giải pháp phần mềm liên quan. o Là đầu mối giao tiếp chính với AM, đội phát triển/triển khai, đối tác phần mềm và khách hàng về khía cạnh nghiệp vụ và giải pháp - Trong và Sau Triển Khai: Tham gia hỗ trợ team triển khai/phát triển về mặt làm rõ nghiệp vụ và kiểm thử nghiệm thu người dùng (UAT) - Phát triển Giải pháp & Đào tạo: o Nghiên cứu sản phẩm, giải pháp, dịch vụ phần mềm mới trên thị trường. o Làm việc với các đối tác phần mềm để nắm bắt công nghệ và tính năng mới. o Giới thiệu các sản phẩm, giải pháp, dịch vụ phần mềm mới cho khách hàng. o Chuẩn bị tài liệu và đào tạo nội bộ cho AM (slide, các câu hỏi kiểm tra) về giải pháp phần mềm và nghiệp vụ. o Tham gia các khóa đào tạo (nội bộ, hãng) để nâng cao chuyên môn","- Kiến thức: o Kiến thức về Phân tích Nghiệp vụ (Business Analysis): Nắm vững các kỹ thuật thu thập, phân tích, đặc tả yêu cầu (ví dụ: Use Case, User Story, Process Flow, Data Flow Diagram). o Kiến thức về các giải pháp phần mềm doanh nghiệp: Hiểu biết về các hệ thống như ERP, CRM, DMS, Portal, E-learning, Big Data, AI/Machine Learning, IoT, hoặc các phần mềm chuyên ngành khác. o Hiểu biết về chu trình phát triển phần mềm (SDLC) và các phương pháp phát triển (Waterfall, Agile/Scrum). o Có kiến thức về cơ sở dữ liệu, kiến trúc phần mềm, API, tích hợp hệ thống ở mức độ đủ để tư vấn và làm rõ yêu cầu kỹ thuật. - Trình độ: Tốt nghiệp Đại học trở lên chuyên ngành CNTT, Hệ thống thông tin, Khoa học Máy tính hoặc các ngành liên quan. - Kinh nghiệm: Tối thiểu 2 năm kinh nghiệm ở vị trí Business Analyst (BA), Chuyên viên Tư vấn Phần mềm, hoặc Presales Phần mềm - Kỹ năng: o Phân tích nghiệp vụ: Khả năng nắm bắt vấn đề, quy trình nghiệp vụ phức tạp và chuyển hóa thành yêu cầu phần mềm. o Giao tiếp và lắng nghe: Để tương tác hiệu quả với khách hàng (bao gồm cả khối chính phủ). o Thuyết trình, trình bày tài liệu giải pháp nghiệp vụ rõ ràng, logic. o Tiếng Anh thành thạo (nghe, nói, đọc, viết) để đọc hiểu tài liệu và làm việc với đối tác. o Tư duy logic và khả năng giải quyết vấn đề","Lương: thoả thuận Thưởng tháng 13 + Thưởng nóng + Thưởng thi đua quý/năm Môi trường làm việc năng động, thân thiện, chuyên nghiệp với nhiều cơ hội phát triển Được tham gia các khóa đào tạo nội bộ và bên ngoài để nâng cao kiến thức, kỹ năng mềm và trình độ chuyên môn. Được đào tạo trực tiếp từ các Cố vấn/ chuyên gia Tư vấn và Công nghệ …. Phúc lợi: Teambuilding, nghỉ mát, sinh nhật, thưởng lễ/tết,… Các chế độ bảo hiểm, nghỉ phép,… theo Luật lao động Thời gian làm việc: 8h00 – 12h00, 13h00 – 17h00, Thứ 2 – Thứ 6. Thứ 7 làm việc tuần 2 và 4 trong tháng.",,,"Hiện FSI là Nhà cung cấp hàng đầu trong lĩnh vực giải pháp, dịch vụ số hóa tài liệu và Tích hợp hệ thống Công nghệ thông tin. FSI là nhà phân phối độc quyền, duy nhất Máy scan Plustek, Kodak, SMA tại thị trường miền Bắc, Nhà phân phối độc quyền máy scan, in khổ A0 của ROWE tại khu vực Đông Dương, Gold Partner của Hp, IBM, Canon, Fujitsu... FSI đã triển khai thành công nhiều dự án số hóa tài liệu, tích hợp hệ thống trọng điểm tại các Bộ, Sở, Ngành của Hà Nội và các tỉnh Sứ mệnh của chúng tôi là: Nghiên cứu, chuyển giao các giải pháp công nghệ tiên tiến trên cơ sở thấu hiểu nhu cầu của khách hàng để cung cấp các giải pháp CNTT thông minh, phù hợp với thực tế, nhằm mang lại giá trị và hiệu quả cao FSI đang hướng tới mục tiêu trở thành Đơn vị cung cấp giải pháp, dịch vụ số hóa tài liệu số 1 tại Việt Nam trước năm 2020 Xem thêm Thu gọn Tuyển dụng Tất cả tỉnh/thành phố Hà Nội Hồ Chí Minh Bình Dương Bắc Ninh Đồng Nai Hưng Yên Hải Dương Đà Nẵng Hải Phòng An Giang Bà Rịa-Vũng Tàu Bắc Giang Bắc Kạn Bạc Liêu Bến Tre Bình Định Bình Phước Bình Thuận Cà Mau Cần Thơ Cao Bằng Cửu Long Đắk Lắk Đắc Nông Điện Biên Đồng Tháp Gia Lai Hà Giang Hà Nam Hà Tĩnh Hậu Giang Hoà Bình Khánh Hoà Kiên Giang Kon Tum Lai Châu Lâm Đồng Lạng Sơn Lào Cai Long An Miền Bắc Miền Nam Miền Trung Nam Định Nghệ An Ninh Bình Ninh Thuận Phú Thọ Phú Yên Quảng Bình Quảng Nam Quảng Ngãi Quảng Ninh Quảng Trị Sóc Trăng Sơn La Tây Ninh Thái Bình Thái Nguyên Thanh Hoá Thừa Thiên Huế Tiền Giang Toàn Quốc Trà Vinh Tuyên Quang Vĩnh Long Vĩnh Phúc Yên Bái Nước Ngoài Đức Nhật Bản Tìm kiếm 1 /12 trang Xem tất cả việc làm với từ khóa “ ” Thương hiệu lớn tiêu biểu cùng lĩnh vực Pro Company Những thương hiệu tuyển dụng đã khẳng định được vị thế trên thị trường. Công ty Cổ phần Tập đoàn Đầu tư - Thương mại và Xây dựng Vân Khánh Điện tử / Điện lạnh chi nhánh công ty TNHH Lixil Việt Nam tại Bình Dương Sản xuất Công Ty Cổ Phần Petec Bình Định Năng lượng CHI NHÁNH CÔNG TRÌNH VIETTEL HÀ TĨNH - TỔNG CÔNG TY CỔ PHẦN CÔNG TRÌNH VIETTEL Viễn thông Công ty TNHH Dreamtech Việt Nam Điện tử / Điện lạnh CÔNG TY CỔ PHẦN THANH TOÁN ĐIỆN TỬ VNPT IT - Phần mềm CÔNG TY TNHH XUẤT NHẬP KHẨU PHÁT TRIỂN ĐÔNG DƯƠNG - TẬP ĐOÀN THỂ THAO KINGSPORT Bán lẻ - Hàng tiêu dùng - FMCG CÔNG TY TNHH THƯƠNG MẠI VÀ DỊCH VỤ ĐƯỜNG KHÔNG RỒNG VIỄN ĐÔNG Logistics - Vận tải CÔNG TY TNHH KỸ NGHỆ PHÚC ANH Sản xuất Công ty Cổ phần Cao su Sài Gòn - KYMDAN Bán lẻ - Hàng tiêu dùng - FMCG Tìm hiểu thêm về TopCV Pro Việc làm “ ” từ các công ty tương tự Thông tin liên hệ Địa chỉ công ty Tầng 5A – Tòa nhà Lâm Viên – 107A Nguyễn Phong Sắc – Cầu Giấy – Hà Nội Xem bản đồ Chia sẻ công ty tới bạn bè Sao chép đường dẫn Chia sẻ qua mạng xã hội",,
